DBN,school_0me,male,female,male_ratio,female_ratio27Q465,FAR ROCKAWAY HIGH SCHOOL,35,56,0.384615385,0.61538461527Q475,RICHMOND HILL HIGH SCHOOL,428,413,0.508917955,0.49108204527Q480,JOHN ADAMS HIGH SCHOOL,517,467,0.525406504,0.47459349627Q650,"HIGH SCH-CONSTRUCTION, TRADES, ENGINEERING & ARCHI",116,79,0.594871795,0.40512820528Q310,QUEENS COLLEGIATE - A COLLEGE BOARD SCHOOL,1,0,1,028Q338,QUEENS SATELLITE HIGH SCHOOL,41,63,0.394230769,0.60576923128Q440,FOREST HILLS HIGH SCHOOL,524,503,0.510223953,0.48977604728Q470,JAMAICA HIGH SCHOOL,201,173,0.537433155,0.46256684528Q505,HILLCREST HIGH SCHOOL,403,505,0.443832599,0.55616740128Q620,THOMAS A EDISON CAREER AND TECHNICAL HIGH SCHOOL,434,188,0.697749196,0.30225080428Q680,QUEENS GATEWAY TO HEALTH SCIENCES SECONDARY SCHOOL,39,59,0.397959184,0.60204081628Q687,QUEENS HIGH SCHOOL FOR THE SCIENCES AT YORK COLLEG,39,48,0.448275862,0.55172413828Q690,HS FOR LAW ENFORCEMENT AND PUBLIC SAFETY,57,72,0.441860465,0.55813953529Q248,QUEENS PREPARATORY ACADEMY,51,43,0.542553191,0.45744680929Q259,PATHWAYS COLLEGE PREPARATORY SCHOOL,28,32,0.466666667,0.53333333329Q265,EXCELSIOR PREPARATORTY HIGH SCHOOL,65,49,0.570175439,0.42982456129Q272,GEORGE WASHINGTON CARVER HIGH SCHOOL FOR THE SCIEN,47,64,0.423423423,0.57657657729Q283,PREPARATORY ACADEMY FOR WRITERS,15,40,0.272727273,0.72727272729Q492,MATH/SCIENCE RESEARCH AND TECHNOLOGY MAGNET HS,69,56,0.552,0.44829Q494,"LAW, GOVERNMENT AND COMMUNITY SERVICE HIGH SCHOOL",50,70,0.416666667,0.58333333329Q496,BUSINESS/COMPUTER APPLICATIONS & ENTREPRENEURSHIP,74,45,0.621848739,0.37815126129Q498,HUMANITIES AND ARTS MAGNET HIGH SCHOOL,47,60,0.439252336,0.56074766430Q445,WILLIAM CULLEN BRYANT HIGH SCHOOL,409,339,0.546791444,0.45320855630Q450,LONG ISLAND CITY HIGH SCHOOL,414,417,0.498194946,0.50180505430Q501,FRANK SI0TRA SCHOOL OF THE ARTS HIGH SCHOOL,38,100,0.275362319,0.72463768130Q502,INFORMATION TECHNOLOGY HIGH SCHOOL,168,80,0.677419355,0.32258064530Q555,NEWCOMERS HIGH SCHOOL,134,113,0.542510121,0.45748987930Q575,ACADEMY OF AMERICAN STUDIES,70,85,0.451612903,0.54838709730Q580,BACCALAUREATE SCHOOL FOR GLOBAL EDUCATION,22,42,0.34375,0.6562531R047,CSI HIGH SCHOOL FOR INTER0TIO0L STUDIES,41,61,0.401960784,0.59803921631R064,GAYNOR MCCOWN EXPEDITIO0RY LEARNING SCHOOL,1,0,1,031R080,THE MICHAEL J PETRIDES SCHOOL,66,61,0.519685039,0.48031496131R440,NEW DORP HIGH SCHOOL,317,261,0.548442907,0.45155709331R445,PORT RICHMOND HIGH SCHOOL,289,309,0.483277592,0.51672240831R450,CURTIS HIGH SCHOOL,312,379,0.451519537,0.54848046331R455,TOTTENVILLE HIGH SCHOOL,520,484,0.517928287,0.48207171331R460,SUSAN E WAGNER HIGH SCHOOL,369,392,0.484888305,0.51511169531R470,CONCORD HIGH SCHOOL,35,48,0.421686747,0.57831325331R600,RALPH R MCKEE CAREER AND TECHNICAL HIGH SCHOOL,129,39,0.767857143,0.23214285731R605,STATEN ISLAND TECHNICAL HIGH SCHOOL,129,81,0.614285714,0.38571428632K403,ACADEMY FOR ENVIRONMENTAL LEADERSHIP,49,54,0.475728155,0.52427184532K545,EBC HIGH SCHOOL FOR PUBLIC SERVICE,90,79,0.532544379,0.46745562132K549,BUSHWICK SCHOOL FOR SOCIAL JUSTICE,49,54,0.475728155,0.52427184532K552,ACADEMY OF URBAN PLANNING,61,62,0.495934959,0.50406504132K554,ALL CITY LEADERSHIP SECONDARY SCHOOL,16,19,0.457142857,0.54285714332K556,BUSHWICK LEADERS HS FOR ACADEMIC EXCELLENCE,72,66,0.52173913,0.4782608732K564,BUSHWICK COMMUNITY HIGH SCHOOL,66,83,0.44295302,0.5570469802M316,URBAN ASSEMBLY SCHOOL OF BUSINESS FOR YOUNG WOMEN,0,61,0,104M610,YOUNG WOMEN'S LEADERSHIP SCHOOL,0,64,0,106M293,CITY COLLEGE ACADEMY OF THE ARTS,0,1,0,108X282,WOMEN'S ACADEMY OF EXCELLENCE,0,65,0,112X158,THEODORE ROOSEVELT GATHINGS MIDDLE SCHOOL,0,1,0,128Q896,YOUNG WOMEN'S LEADERSHIP SCHOOL OF QUEENS,0,57,0,1