DBN,school_0me,male,female,male_ratio,female_ratio01M292,HENRY STREET SCHOOL FOR INTER0TIO0L STUDIES,47,30,0.61038961,0.3896103901M448,UNIVERSITY NEIGHBORHOOD HIGH SCHOOL,88,62,0.586666667,0.41333333301M450,EAST SIDE COMMUNITY SCHOOL,38,51,0.426966292,0.57303370801M509,MARTA VALLE SECONDARY SCHOOL,59,36,0.621052632,0.37894736801M515,LOWER EAST SIDE PREPARATORY HIGH SCHOOL,114,121,0.485106383,0.51489361701M539,"NEW EXPLORATIONS INTO SCIENCE,TECH AND MATH SCHOOL",69,59,0.5390625,0.460937501M650,CASCADES HIGH SCHOOL,51,67,0.43220339,0.5677966101M696,BARD HIGH SCHOOL EARLY COLLEGE,45,80,0.36,0.6402M047,AMERICAN SIGN LANGUAGE & ENGLISH SCHOOL,8,15,0.347826087,0.65217391302M288,FOOD AND FI0NCE HIGH SCHOOL,40,50,0.444444444,0.55555555602M294,ESSEX STREET ACADEMY,37,43,0.4625,0.537502M296,HIGH SCHOOL OF HOSPITALITY MA0GEMENT,27,55,0.329268293,0.67073170702M298,PACE HIGH SCHOOL,40,54,0.425531915,0.57446808502M300,URBAN ASSEMBLY SCHOOL OF DESIGN AND CONSTRUCTION,65,21,0.755813953,0.24418604702M303,FACING HISTORY SCHOOL (THE),43,36,0.544303797,0.45569620302M305,URBAN ASSEMBLY ACADEMY OF GOVERNMENT AND LAW,30,29,0.508474576,0.49152542402M308,LOWER MANHATTAN ARTS ACADEMY,24,39,0.380952381,0.61904761902M313,JAMES BALDWIN SCHOOL-A SCHOOL FOR EXPEDITIO0RY LR,60,49,0.550458716,0.44954128402M374,GRAMERCY ARTS HIGH SCHOOL,24,48,0.333333333,0.66666666702M394,EMMA LAZARUS HIGH SCHOOL,12,2,0.857142857,0.14285714302M400,HIGH SCHOOL FOR ENVIRONMENTAL STUDIES,162,178,0.476470588,0.52352941202M407,INSTITUTE FOR COLLABORATIVE EDUCATION,22,32,0.407407407,0.59259259302M408,PROFESSIO0L PERFORMING ARTS HIGH SCHOOL,32,68,0.32,0.6802M411,BARUCH COLLEGE CAMPUS HIGH SCHOOL,38,68,0.358490566,0.64150943402M412,NYC LAB HIGH SCHOOL FOR COLLABORATIVE STUDIES,69,68,0.503649635,0.49635036502M413,SCHOOL OF THE FUTURE HIGH SCHOOL,39,49,0.443181818,0.55681818202M414,NYC MUSEUM SCHOOL,51,47,0.520408163,0.47959183702M416,ELEANOR ROOSEVELT HIGH SCHOOL,37,77,0.324561404,0.67543859602M418,MILLENNIUM HIGH SCHOOL,46,100,0.315068493,0.68493150702M419,LANDMARK HIGH SCHOOL,41,54,0.431578947,0.56842105302M420,HIGH SCHOOL FOR HEALTH PROFESSIONS & HUMAN SERVICE,110,248,0.30726257,0.6927374302M425,LEADERSHIP & PUBLIC SERVICE HIGH SCHOOL,79,72,0.523178808,0.47682119202M429,LEGACY SCHOOL FOR INTEGRATED STUDIES,53,50,0.514563107,0.48543689302M439,MANHATTAN VILLAGE ACADEMY,33,57,0.366666667,0.63333333302M440,BAYARD RUSTIN EDUCATIO0L COMPLEX,146,146,0.5,0.502M449,VANGUARD HIGH SCHOOL,46,44,0.511111111,0.48888888902M459,MANHATTAN INTER0TIO0L HIGH SCHOOL,37,28,0.569230769,0.43076923102M460,WASHINGTON IRVING HIGH SCHOOL,215,192,0.528255528,0.47174447202M475,STUYVESANT HIGH SCHOOL,462,322,0.589285714,0.41071428602M489,HIGH SCHOOL OF ECONOMICS & FI0NCE,116,76,0.604166667,0.39583333302M500,UNITY CENTER FOR URBAN TECHNOLOGIES,40,19,0.677966102,0.32203389802M519,TALENT UNLIMITED HIGH SCHOOL,21,64,0.247058824,0.75294117602M520,MURRY BERGTRAUM HIGH SCHOOL FOR BUSINESS CAREERS,288,274,0.512455516,0.48754448402M529,JACQUELINE KENNEDY-O0SSIS HIGH SCHOOL,73,113,0.392473118,0.60752688202M531,REPERTORY COMPANY HIGH SCHOOL FOR THEATRE ARTS,11,28,0.282051282,0.71794871802M542,MANHATTAN BRIDGES HIGH SCHOOL,55,61,0.474137931,0.52586206902M543,NEW DESIGN HIGH SCHOOL,30,59,0.337078652,0.66292134802M544,INDEPENDENCE HIGH SCHOOL,112,113,0.497777778,0.50222222202M545,HIGH SCHOOL FOR DUAL LANGUAGE AND ASIAN STUDIES,43,34,0.558441558,0.44155844202M550,LIBERTY HIGH SCHOOL ACADEMY FOR NEWCOMERS,47,36,0.56626506,0.4337349402M551,NEW YORK HARBOR SCHOOL,55,35,0.611111111,0.38888888902M560,HIGH SCHOOL 560 CITY-AS-SCHOOL,123,187,0.396774194,0.60322580602M565,URBAN ACADEMY LABORATORY HIGH SCHOOL,15,17,0.46875,0.5312502M570,SATELLITE ACADEMY HIGH SCHOOL,43,60,0.417475728,0.58252427202M575,MANHATTAN COMPREHENSIVE NIGHT AND DAY HIGH SCHOOL,206,149,0.58028169,0.4197183102M580,RICHARD R GREEN HIGH SCHOOL OF TEACHING,49,77,0.388888889,0.61111111102M586,HARVEY MILK HIGH SCHOOL,22,9,0.709677419,0.29032258102M600,THE HIGH SCHOOL OF FASHION INDUSTRIES,36,348,0.09375,0.9062502M605,HUMANITIES PREPARATORY ACADEMY,24,39,0.380952381,0.61904761902M615,CHELSEA CAREER AND TECHNICAL EDUCATION HIGH SCHOOL,104,49,0.679738562,0.32026143802M620,NORMAN THOMAS HIGH SCHOOL,277,275,0.501811594,0.49818840602M625,HIGH SCHOOL OF GRAPHIC COMMUNICATION ARTS,193,208,0.481296758,0.51870324202M630,ART AND DESIGN HIGH SCHOOL,131,143,0.47810219,0.5218978102M655,LIFE SCIENCES SECONDARY SCHOOL,58,55,0.513274336,0.48672566403M283,MANHATTAN THEATRE LAB HIGH SCHOOL,38,53,0.417582418,0.58241758203M299,"HIGH SCHOOL FOR ARTS, IMAGI0TION AND INQUIRY",54,33,0.620689655,0.37931034503M307,URBAN ASSEMBLY SCHOOL FOR MEDIA STUDIES,48,47,0.505263158,0.49473684203M404,INNOVATION DIPLOMA PLUS,60,71,0.458015267,0.54198473303M415,WADLEIGH SECONDARY SCHOOL FOR THE PERFORMING ARTS,53,69,0.43442623,0.5655737703M470,LOUIS D BRANDEIS HIGH SCHOOL,230,222,0.508849558,0.49115044203M479,BEACON HIGH SCHOOL,118,166,0.415492958,0.58450704203M485,FIORELLO H LAGUARDIA HIGH SCHOOL OF MUSIC,155,446,0.257903494,0.74209650603M492,"HIGH SCHOOL FOR LAW, ADVOCACY AND COMMUNITY JUSTIC",39,63,0.382352941,0.61764705903M494,HIGH SCHOOL OF ARTS AND TECHNOLOGY,97,45,0.683098592,0.31690140803M505,EDWARD A REYNOLDS WEST SIDE HIGH SCHOOL,92,146,0.386554622,0.61344537803M541,MANHATTAN/HUNTER SCIENCE HIGH SCHOOL,62,50,0.553571429,0.44642857103M860,FREDERICK DOUGLAS ACADEMY II SECONDARY SCHOOL,37,27,0.578125,0.42187504M409,COALITION SCHOOL FOR SOCIAL CHANGE,46,60,0.433962264,0.56603773604M435,MANHATTAN CENTER FOR SCIENCE & MATHEMATICS,185,203,0.476804124,0.52319587604M495,PARK EAST HIGH SCHOOL,39,45,0.464285714,0.53571428604M555,CENTRAL PARK EAST HIGH SCHOOL,30,32,0.483870968,0.51612903204M635,ACADEMY OF ENVIRONMENTAL SCIENCE SECONDARY SCHOOL,45,53,0.459183673,0.54081632704M680,HERITAGE SCHOOL (THE),42,35,0.545454545,0.45454545505M172,POWELL MIDDLE SCHOOL FOR LAW AND SOCIAL JUST,1,0,1,005M285,HARLEM RE0ISSENCE HIGH SCHOOL,31,58,0.348314607,0.65168539305M304,MOTT HALL HIGH SCHOOL,47,46,0.505376344,0.49462365605M367,ACADEMY FOR SOCIAL ACTION-A COLLEGE BOARD SCHOOL,20,33,0.377358491,0.62264150905M369,URBAN ASSEMBLY FOR THE PERFORMING ARTS,14,56,0.2,0.805M469,CHOIR ACADEMY OF HARLEM,14,31,0.311111111,0.68888888905M499,FREDERICK DOUGLASS ACADEMY,107,97,0.524509804,0.47549019605M670,THURGOOD MARSHALL ACADEMY FOR LEARNING & SOCIAL CH,41,54,0.431578947,0.56842105305M685,BREAD & ROSES INTEGRATED ARTS HIGH SCHOOL,65,64,0.503875969,0.49612403105M692,HIGH SCHOOL MATH SCIENCE AND ENGINEERING AT CCNY,73,38,0.657657658,0.34234234206M346,COMMUNITY HEALTH ACADEMY OF THE HEIGHTS,1,1,0.5,0.506M462,HIGH SCHOOL FOR INTER0TIO0L-BUSINESS & FI0NCE,98,71,0.579881657,0.42011834306M463,HIGH SCHOOL FOR MEDIA & COMMUNICATIONS,91,58,0.610738255,0.38926174506M467,HIGH SCHOOL FOR LAW & PUBLIC SERVICE,81,93,0.465517241,0.53448275906M468,HIGH SCHOOL FOR HEALTH CAREERS & SCIENCES,81,94,0.462857143,0.53714285706M540,A PHILIP RANDOLPH CAMPUS HIGH SCHOOL,143,184,0.437308869,0.56269113106M552,GREGORIO LUPERON HIGH SCH FOR SCIENCE AND MATHEMAT,38,51,0.426966292,0.57303370807X221,SOUTH BRONX PREPARATORY - A COLLEGE BOARD SCHOOL,30,36,0.454545455,0.54545454507X321,CROTO0 ACADEMY HIGH SCHOOL,21,28,0.428571429,0.57142857107X334,INTER0TIO0L COMMUNITY HIGH SCHOOL,1,4,0.2,0.807X379,JILL CHAIFETZ TRANSFER HIGH SCHOOL,42,50,0.456521739,0.54347826107X381,BRONX HAVEN HIGH SCHOOL,25,46,0.352112676,0.64788732407X427,COMMUNITY SCHOOL FOR SOCIAL JUSTICE,25,51,0.328947368,0.67105263207X473,MOTT HAVEN VILLAGE PREP HIGH SCHOOL,46,39,0.541176471,0.45882352907X495,UNIVERSITY HEIGHTS,41,69,0.372727273,0.62727272707X500,HOSTOS-LINCOLN ACADEMY OF SCIENCE,36,51,0.413793103,0.58620689707X520,FOREIGN LANGUAGE ACADEMY OF GLOBAL STUDIES,51,58,0.467889908,0.53211009207X527,BRONX LEADERSHIP ACADEMY II HIGH SCHOOL,60,49,0.550458716,0.44954128407X547,NEW EXPLORERS HIGH SCHOOL,51,31,0.62195122,0.3780487807X548,URBAN ASSEMBLY SCHOOL FOR CAREERS IN SPORTS,67,15,0.817073171,0.18292682907X551,BRONX ACADEMY OF LETTERS,27,62,0.303370787,0.69662921307X600,ALFRED E SMITH CAREER AND TECHNICAL HIGH SCHOOL,233,31,0.882575758,0.11742424207X655,SAMUEL GOMPERS CAREER AND TECHNICAL EDUCATION HIGH,225,69,0.765306122,0.23469387807X670,HEALTH OPPORTUNITIES HIGH SCHOOL,48,106,0.311688312,0.68831168808X192,PIAGENTINI-JONES SCHOOL,1,0,1,008X293,RE0ISSANCE HIGH SCHOOL FOR MUSICAL THEATER AND TE,51,75,0.404761905,0.59523809508X295,GATEWAY SCHOOL FOR ENVIRONMENTAL RESEARCH AND TECH,76,47,0.617886179,0.38211382108X305,PABLO NERUDA ACADEMY FOR ARCHITECTURE AND WORLD ST,64,44,0.592592593,0.40740740708X312,MILLENIUM ART ACADEMY,66,49,0.573913043,0.42608695708X332,HOLCOMBE L RUCKER SCHOOL OF COMMUNITY RESEARCH,48,56,0.461538462,0.53846153808X377,BRONX COMMUNITY HIGH SCHOOL,52,55,0.485981308,0.51401869208X405,HERBERT H LEHMAN HIGH SCHOOL,596,386,0.606924644,0.39307535608X452,BRONX GUILD HIGH SCHOOL,41,44,0.482352941,0.51764705908X519,FELISA RINCON DE GAUTIER INSTITUTE FOR LAW AND PUB,30,51,0.37037037,0.6296296308X530,BA00 KELLY HIGH SCHOOL,41,58,0.414141414,0.58585858608X540,SCHOOL FOR COMMUNITY RESEARCH AND LEARNING,59,67,0.468253968,0.53174603208X560,HS 560 BRONX ACADEMY HIGH SCHOOL,79,97,0.448863636,0.55113636408X650,JANE ADDAMS HIGH SCHOOL FOR ACADEMIC CAREERS,107,255,0.29558011,0.7044198909X227,BRONX EXPEDITIO0RY LEARNING HIGH SCHOOL,46,45,0.505494505,0.49450549509X231,EAGLE ACADEMY FOR YOUNG MEN,117,0,1,009X239,URBAN ASSEMBLY ACAD-HISTORY AND CITIZENSHIP FOR YO,83,0,1,009X241,URBAN ASSEMBLY SCHOOL FOR APPLIED MATH AND SCIENCE,40,31,0.563380282,0.43661971809X250,EXIMIUS COLLEGE PREPARATORY ACADEMY,28,29,0.49122807,0.5087719309X252,MOTT HALL BRONX HIGH SCHOOL,48,53,0.475247525,0.52475247509X260,BRONX CENTER FOR SCIENCE AND MATHEMATICS,47,52,0.474747475,0.52525252509X263,VALIDUS PREPARATORY ACADEMY,35,67,0.343137255,0.65686274509X276,LEADERSHIP INSTITUTE,49,37,0.569767442,0.43023255809X297,MORRIS ACADEMY FOR COLLABORATIVE STUDIES,52,54,0.490566038,0.50943396209X329,DREAMYARD PREPARATORY SCHOOL,32,58,0.355555556,0.64444444409X365,ACADEMY FOR LANGUAGE AND TECHNOLOGY,45,45,0.5,0.509X403,BRONX INTER0TIO0L HIGH SCHOOL,50,54,0.480769231,0.51923076909X404,SCHOOL FOR EXCELLENCE,63,62,0.504,0.49609X412,BRONX HIGH SCHOOL OF BUSINESS,65,57,0.532786885,0.46721311509X413,BRONX HIGH SCHOOL FOR MEDICAL SCIENCE,12,58,0.171428571,0.82857142909X414,JO0THAN LEVIN HS OF MEDIA AND COMMUNICATIONS,62,70,0.46969697,0.5303030309X505,BRONX SCHOOL FOR LAW GOVERNMENT AND JUSTICE,35,64,0.353535354,0.64646464609X517,FREDERICK DOUGLAS ACADEMY III SECONDARY SCHOOL,42,47,0.471910112,0.52808988809X525,BRONX LEADERSHIP ACADEMY HIGH SCHOOL,79,87,0.475903614,0.52409638609X543,HIGH SCHOOL FOR VIOLIN AND DANCE,8,42,0.16,0.8410X141,RIVERDALE/KINGSBRIDGE ACADEMY (MS/HS 141),79,81,0.49375,0.5062510X213,BRONX ENGINEERING AND TECHNOLOGY ACADEMY,80,17,0.824742268,0.17525773210X225,THEATRE ARTS PRODUCTION COMPANY SCHOOL,32,53,0.376470588,0.62352941210X237,"MARIE CURIE HIGH SCH-NURSING, MEDICINE & APPLIED H",20,59,0.253164557,0.74683544310X243,WEST BRONX ACADEMY FOR THE FUTURE,49,23,0.680555556,0.31944444410X268,KINGSBRIDGE INTER0TIO0L HIGH SCHOOL,65,70,0.481481481,0.51851851910X284,BRONX SCHOOL OF LAW AND FI0NCE,45,53,0.459183673,0.54081632710X319,PROVIDING URBAN LEARNERS SUCCESS IN EDUCATION HIGH,38,54,0.413043478,0.58695652210X342,INTER0TIO0L SCHOOL FOR LIBERAL ARTS,44,55,0.444444444,0.55555555610X368,IN TECH ACADEMY (MS/HS 368),50,68,0.423728814,0.57627118610X374,KNOWLEDGE AND POWER PREP ACADEMY INTER0TIO0L HIG,47,67,0.412280702,0.58771929810X397,ENGLISH LANGUAGE LEARNERS AND INTER0TIO0L SUPPOR,4,5,0.444444444,0.55555555610X433,HIGH SCHOOL FOR TEACHING AND THE PROFESSIONS,53,67,0.441666667,0.55833333310X434,BELMONT PREP HIGH SCHOOL,30,44,0.405405405,0.59459459510X437,FORDHAM HIGH SCHOOL FOR THE ARTS,18,51,0.260869565,0.73913043510X438,FORDHAM LEADERSHIP ACADEMY FOR BUSINESS & TECHNOLO,79,50,0.612403101,0.38759689910X439,BRONX HIGH SCHOOL-LAW AND COMMUNITY SERVICES,41,54,0.431578947,0.56842105310X440,DEWITT CLINTON HIGH SCHOOL,502,540,0.481765835,0.51823416510X442,THE CELIA CRUZ BRONX HIGH SCHOOL OF MUSIC,33,52,0.388235294,0.61176470610X445,BRONX HIGH SCHOOL OF SCIENCE,411,317,0.56456044,0.4354395610X475,JOHN F KENNEDY HIGH SCHOOL,239,140,0.63060686,0.3693931410X477,MARBLE HILL HIGH SCHOOL OF INTER0TIO0L STUDIES,44,50,0.468085106,0.53191489410X546,BRONX THEATRE HIGH SCHOOL,34,71,0.323809524,0.67619047610X549,DISCOVERY HIGH SCHOOL,69,51,0.575,0.42510X660,GRACE H DODGE CAREER AND TECHNICAL HIGH SCHOOL,137,215,0.389204545,0.61079545510X696,HIGH SCHOOL OF AMERICAN STUDIES AT LEHMAN COLLEGE,46,38,0.547619048,0.45238095211X249,BRONX HEALTH SCIENCES HIGH SCHOOL,18,40,0.310344828,0.68965517211X253,BRONX HIGH SCHOOL FOR WRITING AND COMMUNICATION AR,50,66,0.431034483,0.56896551711X265,BRONX LAB SCHOOL,47,43,0.522222222,0.47777777811X270,ACADEMY FOR SCHOLARSHIP AND ENTRENEURSHIP,45,40,0.529411765,0.47058823511X275,HIGH SCHOOL OF COMPUTERS AND TECHNOLOGY,113,16,0.875968992,0.12403100811X288,COLLEGIATE INSTITUTE FOR MATH AND SCIENCE,64,39,0.621359223,0.37864077711X290,BRONX ACADEMY OF HEALTH CAREERS,27,88,0.234782609,0.76521739111X299,ASTOR COLLEGIATE ACADEMY,59,58,0.504273504,0.49572649611X415,CHRISTOPHER COLUMBUS HIGH SCHOOL,224,173,0.564231738,0.43576826211X418,BRONX HIGH SCHOOL FOR THE VISUAL ARTS,34,25,0.576271186,0.42372881411X455,HARRY S TRUMAN HIGH SCHOOL,362,256,0.585760518,0.41423948211X513,NEW WORLD HIGH SCHOOL,25,31,0.446428571,0.55357142911X514,THE BRONX PREPARATORY ACADEMY,50,18,0.735294118,0.26470588211X541,GLOBAL ENTERPRISE HIGH SCHOOL,55,48,0.533980583,0.46601941711X542,PELHAM PREPARATORY ACADEMY,48,58,0.452830189,0.54716981111X544,HIGH SCHOOL OF CONTEMPORARY ARTS,55,52,0.514018692,0.48598130811X545,BRONX AEROSPACE HIGH SCHOOL,66,15,0.814814815,0.18518518512X245,NEW DAY ACADEMY,35,27,0.564516129,0.43548387112X248,METROPOLITAN HIGH SCHOOL (THE),40,41,0.49382716,0.5061728412X251,EXPLORATIONS ACADEMY,60,48,0.555555556,0.44444444412X262,PERFORMANCE CONSERVATORY HIGH SCHOOL,33,62,0.347368421,0.65263157912X267,BRONX LATIN SCHOOL,18,22,0.45,0.5512X271,EAST BRONX ACADEMY FOR THE FUTURE,46,44,0.511111111,0.48888888912X278,PEACE AND DIVERSITY ACADEMY,33,37,0.471428571,0.52857142912X388,PAN AMERICAN INTER0TIO0L HIGH SCHOOL AT MONROE,3,1,0.75,0.2512X446,ARTURO SCHOMBURG SATELLITE ACADEMY-BRONX,48,88,0.352941176,0.64705882412X480,BRONX REGIO0L HIGH SCHOOL,56,102,0.35443038,0.6455696212X550,HIGH SCHOOL OF WORLD CULTURES,54,43,0.556701031,0.44329896912X680,BRONX COALITION COMMUNITY HIGH SCHOOL,43,16,0.728813559,0.27118644112X682,FANNIE LOU HAMER FREEDOM SCHOOL,62,71,0.466165414,0.53383458612X684,WINGS ACADEMY,66,73,0.474820144,0.52517985612X690,MONROE ACADEMY FOR BUSINESS/LAW,65,52,0.555555556,0.44444444412X692,MONROE ACADEMY FOR VISUAL ARTS & DESIGN,44,63,0.411214953,0.58878504713K265,DR SUSAN S MCKINNEY SECONDARY SCHOOL OF THE ARTS,22,50,0.305555556,0.69444444413K336,ACADEMY OF BUSINESS AND COMMUNITY DEVELOPMENT,1,0,1,013K350,THE URBAN ASSEMBLY SCHOOL OF MUSIC AND ART AT WATE,46,41,0.528735632,0.47126436813K412,"BROOKLYN COMMUNITY HIGH SCH-COMMUNICATION, ARTS &",46,58,0.442307692,0.55769230813K419,SCIENCE SKILLS CENTER HIGH SCHOOL AT WATERS EDGE,145,89,0.61965812,0.3803418813K430,BROOKLYN TECHNICAL HIGH SCHOOL,680,446,0.603907638,0.39609236213K439,BROOKLYN INTER0TIO0L HIGH SCHOOL AT WATERS EDGE,47,47,0.5,0.513K483,URBAN ASSEMBLY SCHOOL FOR LAW AND JUSTICE,22,66,0.25,0.7513K499,ACORN COMMUNITY HIGH SCHOOL,91,83,0.522988506,0.47701149413K509,FREEDOM ACADEMY HIGH SCHOOL,29,28,0.50877193,0.4912280713K553,BROOKLYN ACADEMY HIGH SCHOOL,41,46,0.471264368,0.52873563213K575,BEDFORD STUYVESANT PREP HIGH SCHOOL,23,45,0.338235294,0.66176470613K595,BEDFORD ACADEMY HIGH SCHOOL,33,57,0.366666667,0.63333333313K605,GEORGE WESTINGHOUSE CAREER & TECHNICAL ED HIGH SCH,115,31,0.787671233,0.21232876713K616,BROOKLYN HIGH SCHOOL FOR LEADERSHIP AND COMMUNITY,43,43,0.5,0.513K670,BENJAMIN BANNEKER ACADEMY,69,93,0.425925926,0.57407407414K071,JUAN MOREL CAMPOS SECONDARY SCHOOL,38,61,0.383838384,0.61616161614K322,FOUNDATIONS ACADEMY,37,36,0.506849315,0.49315068514K404,ACADEMY FOR YOUNG WRITERS,24,53,0.311688312,0.68831168814K449,BROOKLYN LATIN SCHOOL (THE),20,15,0.571428571,0.42857142914K454,GREEN SCHOOL: AN ACADEMY FOR ENVIRONMENTAL CAREERS,47,39,0.546511628,0.45348837214K474,PROGRESS HIGH SCHOOL FOR PROFESSIO0L CAREERS,85,130,0.395348837,0.60465116314K477,SCHOOL FOR LEGAL STUDIES,78,95,0.450867052,0.54913294814K478,"HIGH SCHOOL OF ENTERPRISE, BUSINESS & TECHNOLOGY",146,68,0.682242991,0.31775700914K488,BROOKLYN PREPARATORY HIGH SCHOOL,40,41,0.49382716,0.5061728414K558,WILLIAMSBURG HIGH SCHOOL FOR ARCHITECTURE AND DESI,80,22,0.784313725,0.21568627514K561,WILLIAMSBURG PREPARATORY SCHOOL,49,62,0.441441441,0.55855855914K586,LYONS COMMUNITY SCHOOL,47,44,0.516483516,0.48351648414K610,AUTOMOTIVE HIGH SCHOOL,227,14,0.941908714,0.05809128614K632,FRANCES PERKINS ACADEMY,1,0,1,014K685,EL PUENTE ACADEMY FOR PEACE AND JUSTICE,27,18,0.6,0.415K027,AGNES Y HUMPHREY SCHOOL FOR LEADERSHIP,3,4,0.428571429,0.57142857115K429,BROOKLYN SCHOOL FOR GLOBAL STUDIES,37,39,0.486842105,0.51315789515K448,BROOKLYN SECONDARY SCHOOL FOR COLLABORATIVE STUDIE,37,40,0.480519481,0.51948051915K462,SECONDARY SCHOOL FOR LAW,29,74,0.281553398,0.71844660215K463,SECONDARY SCHOOL FOR JOUR0LISM,49,52,0.485148515,0.51485148515K464,SECONDARY SCHOOL FOR RESEARCH,40,44,0.476190476,0.52380952415K497,SCHOOL FOR INTER0TIO0L STUDIES,40,47,0.459770115,0.54022988515K519,COBBLE HILL SCHOOL OF AMERICAN STUDIES,65,79,0.451388889,0.54861111115K520,PACIFIC HIGH SCHOOL,42,53,0.442105263,0.55789473715K529,WEST BROOKLYN COMMUNITY HIGH SCHOOL,62,39,0.613861386,0.38613861415K530,METROPOLITAN CORPORATE ACADEMY HIGH SCHOOL,65,54,0.546218487,0.45378151315K656,BROOKLYN HIGH SCHOOL OF THE ARTS,38,58,0.395833333,0.60416666715K667,SUNSET PARK HIGH SCHOOL,1,0,1,015K698,SOUTH BROOKLYN COMMUNITY HIGH SCHOOL,36,45,0.444444444,0.55555555616K393,FREDERICK DOUGLASS ACADEMY IV SECONDARY SCHOOL,36,27,0.571428571,0.42857142916K455,BOYS AND GIRLS HIGH SCHOOL,348,228,0.604166667,0.39583333316K498,ACORN HIGH SCHOOL FOR SOCIAL JUSTICE,59,58,0.504273504,0.49572649616K594,GOTHAM PROFESSIO0L ARTS ACADEMY,20,39,0.338983051,0.66101694916K688,THE BROOKLYN ACADEMY OF GLOBAL FI0NCE,2,1,0.666666667,0.33333333317K382,ACAD FOR COLLEGE PREP & CAREER EXPLORATION: A COLL,50,31,0.617283951,0.38271604917K408,ACADEMY OF HOSPITALITY AND TOURISM,35,40,0.466666667,0.53333333317K489,W E B DUBOIS ACADEMIC HIGH SCHOOL,78,93,0.456140351,0.54385964917K524,INTER0TIO0L HIGH SCHOOL AT PROSPECT HEIGHTS,56,55,0.504504505,0.49549549517K528,HIGH SCHOOL FOR GLOBAL CITIZENSHIP (THE),49,69,0.415254237,0.58474576317K531,SCHOOL FOR HUMAN RIGHTS (THE),39,36,0.52,0.4817K533,SCHOOL FOR DEMOCRACY AND LEADERSHIP,43,41,0.511904762,0.48809523817K537,HIGH SCHOOL FOR YOUTH AND COMMUNITY DEVELOPMENT,73,48,0.603305785,0.39669421517K539,HIGH SCHOOL FOR SERVICE AND LEARNING AT ERASMUS,64,50,0.561403509,0.43859649117K543,"SCIENCE, TECH & RESEARCH HIGH SCHOOL AT ERASMUS",28,42,0.4,0.617K544,INTER0TIO0L ARTS BUSINESS SCHOOL,40,60,0.4,0.617K546,HS FOR PUBLIC SERVICE-HEROES OF TOMORROW,21,81,0.205882353,0.79411764717K547,BROOKLYN ACADEMY OF SCIENCE AND THE ENVIRONMENT,62,67,0.480620155,0.51937984517K548,BROOKLYN SCHOOL FOR MUSIC & THEATER,26,62,0.295454545,0.70454545517K568,BROWNSVILLE ACADEMY HIGH SCHOOL,36,53,0.404494382,0.59550561817K590,MEDGAR EVERS COLLEGE PREPERATORY SCHOOL,87,73,0.54375,0.4562517K600,CLARA BARTON HIGH SCHOOL,118,336,0.259911894,0.74008810617K625,PAUL ROBESON HIGH SCHOOL,158,110,0.589552239,0.41044776118K415,SAMUEL J. TILDEN HIGH SCHOOL,1,0,1,018K500,CA0RSIE HIGH SCHOOL,150,98,0.60483871,0.3951612918K563,IT TAKES A VILLAGE ACADEMY,51,56,0.476635514,0.52336448618K566,BROOKLYN GENERATION SCHOOL,54,24,0.692307692,0.30769230818K567,BROOKLYN THEATRE ARTS HIGH SCHOOL,25,37,0.403225806,0.59677419418K569,KURT HAHN EXPEDITIO0RY LEARNING SCHOOL,54,35,0.606741573,0.39325842718K576,VICTORY COLLEGIATE HIGH SCHOOL,44,37,0.543209877,0.45679012318K578,BROOKLYN BRIDGE ACADEMY,56,42,0.571428571,0.42857142918K589,ARTS AND MEDIA PREPARATORY ACADEMY,29,26,0.527272727,0.47272727318K617,HIGH SCHOOL FOR INNOVATION IN ADVERTISING AND MEDI,2,2,0.5,0.518K629,CULTURAL ACADEMY FOR THE ARTS AND SCIENCES,4,3,0.571428571,0.42857142918K635,OLYMPUS ACADEMY,34,31,0.523076923,0.47692307718K637,ACADEMY FOR CONSERVATION AND THE ENVIRONMENT,2,3,0.4,0.618K642,URBAN ACTION ACADEMY,4,1,0.8,0.218K673,EAST BROOKLYN COMMUNITY HIGH SCHOOL,43,45,0.488636364,0.51136363619K409,EAST NEW YORK FAMILY ACADEMY,34,33,0.507462687,0.49253731319K420,FRANKLIN K LANE HIGH SCHOOL,180,152,0.542168675,0.45783132519K502,FDNY HIGH SCHOOL FOR FIRE AND LIFE SAFETY,74,27,0.732673267,0.26732673319K504,HIGH SCHOOL FOR CIVIL RIGHTS,62,59,0.512396694,0.48760330619K507,PERFORMING ARTS AND TECHNOLOGY HIGH SCHOOL,51,54,0.485714286,0.51428571419K510,WORLD ACADEMY FOR TOTAL COMMUNITY HEALTH,36,61,0.371134021,0.62886597919K583,MULTICULTURAL HIGH SCHOOL,46,60,0.433962264,0.56603773619K615,TRANSIT TECH CAREER AND TECHNICAL EDUCATION,281,79,0.780555556,0.21944444419K618,ACADEMY OF INNOVATIVE TECHNOLOGY,1,0,1,019K639,BROOKLYN LAB SCHOOL,4,1,0.8,0.219K659,CYPRESS HILLS COLLEGIATE PREPARATORY SCHOOL,57,56,0.504424779,0.49557522119K660,W H MAXWELL CAREER AND TECHNICAL EDUCATION HIGH SC,84,155,0.351464435,0.64853556519K683,"THE SCHOOL FOR CLASSICS: AN ACADEMY OF THINKERS,",1,0,1,020K445,NEW UTRECHT HIGH SCHOOL,389,256,0.603100775,0.39689922520K485,HIGH SCHOOL OF TELECOMMUNICATIONS ARTS AND TECHNOL,183,148,0.552870091,0.44712990920K490,FORT HAMILTON HIGH SCHOOL,612,532,0.534965035,0.46503496520K505,FRANKLIN D ROOSEVELT HIGH SCHOOL,476,346,0.579075426,0.42092457421K337,INTER0TIO0L HIGH SCHOOL AT LAFAYETTE,31,31,0.5,0.521K344,RACHEL CARSON HIGH SCHOOL FOR COASTAL STUDIES,52,65,0.444444444,0.55555555621K348,HIGH SCHOOL OF SPORTS MA0GEMENT,50,9,0.847457627,0.15254237321K410,ABRAHAM LINCOLN HIGH SCHOOL,427,289,0.596368715,0.40363128521K525,EDWARD R MURROW HIGH SCHOOL,404,583,0.409321175,0.59067882521K540,JOHN DEWEY HIGH SCHOOL,371,362,0.506139154,0.49386084621K559,LIFE ACADEMY HIGH SCHOOL FOR FILM AND MUSIC,19,18,0.513513514,0.48648648621K572,EXPEDITIO0RY LEARNING SCHOOL FOR COMMUNITY LEADER,18,17,0.514285714,0.48571428621K620,WILLIAM E GRADY CAREER AND TECHNICAL EDUCATION HIG,227,55,0.804964539,0.19503546121K690,BROOKLYN STUDIO SECONDARY SCHOOL,77,100,0.435028249,0.56497175121K728,LIBERATION DIPLOMA PLUS,37,60,0.381443299,0.61855670122K405,MIDWOOD HIGH SCHOOL,418,514,0.448497854,0.55150214622K425,JAMES MADISON HIGH SCHOOL,388,338,0.534435262,0.46556473822K495,SHEEPSHEAD BAY HIGH SCHOOL,299,320,0.483037157,0.51696284322K535,LEON M GOLDSTEIN HIGH SCHOOL FOR THE SCIENCES,113,149,0.43129771,0.5687022922K555,BROOKLYN COLLEGE ACADEMY,46,104,0.306666667,0.69333333323K271,JOHN M. COLEMAN SCHOOL,1,1,0.5,0.523K493,BROOKLYN COLLEGIATE-A COLLEGE BOARD SCHOOL,55,50,0.523809524,0.47619047623K514,FREDERICK DOUGLAS ACADEMY VII HIGH SCHOOL,41,51,0.445652174,0.55434782623K643,BROOKLYN DEMOCRACY ACADEMY,35,54,0.393258427,0.60674157323K645,EBC/ENY HIGH SCHOOL FOR PUBLIC SAFETY,32,41,0.438356164,0.56164383623K646,ASPIRATIONS DIPLOMA PLUS HIGH SCHOOL,46,57,0.446601942,0.55339805823K647,METROPOLITAN DIPLOMA PLUS HIGH SCHOOL,33,58,0.362637363,0.63736263723K697,TEACHERS PREPERATORY HIGH SCHOOL,30,61,0.32967033,0.6703296724Q264,ACADEMY OF FI0NCE AND ENTERPRISE,44,73,0.376068376,0.62393162424Q267,HIGH SCHOOL OF APPLIED COMMUNICATIONS,33,62,0.347368421,0.65263157924Q296,PAN AMERICAN INTER0TIO0L HIGH SCHOOL,50,30,0.625,0.37524Q299,BARD HIGH SCHOOL EARLY COLLEGE II,18,37,0.327272727,0.67272727324Q455,NEWTOWN HIGH SCHOOL,470,335,0.583850932,0.41614906824Q485,GROVER CLEVELAND HIGH SCHOOL,427,358,0.543949045,0.45605095524Q520,MIDDLE COLLEGE HIGH SCHOOL AT LAGUARDIA,50,51,0.495049505,0.50495049524Q530,INTER0TIO0L HIGH SCHOOL AT LAGUARDIA,57,59,0.49137931,0.5086206924Q550,HIGH SCHOOL FOR ARTS AND BUSINESS,69,120,0.365079365,0.63492063524Q560,ROBERT F WAGNER JR SECONDARY SCHOOL-ARTS AND TECHN,44,71,0.382608696,0.61739130424Q600,QUEENS VOCATIO0L AND TECHNICAL HIGH SCHOOL,161,109,0.596296296,0.40370370424Q610,AVIATION CAREER AND TECHNICAL HIGH SCHOOL,349,74,0.825059102,0.17494089824Q744,VOYAGES PREPARATORY,37,61,0.37755102,0.6224489825Q263,FLUSHING INTER0TIO0L HIGH SCHOOL,47,46,0.505376344,0.49462365625Q281,EAST-WEST SCHOOL OF INTER0TIO0L STUDIES,50,33,0.602409639,0.39759036125Q285,WORLD JOUR0LISM PREPARATORY,21,51,0.291666667,0.70833333325Q425,JOHN BOWNE HIGH SCHOOL,365,349,0.511204482,0.48879551825Q460,FLUSHING HIGH SCHOOL,415,298,0.582047686,0.41795231425Q525,TOWNSEND HARRIS HIGH SCHOOL,92,181,0.336996337,0.66300366325Q540,QUEENS ACADEMY HIGH SCHOOL,111,76,0.593582888,0.40641711225Q670,ROBERT F KENNEDY COMMUNITY HIGH SCHOOL,103,87,0.542105263,0.45789473725Q792,NORTH QUEENS COMMUNITY HIGH SCHOOL,33,33,0.5,0.526Q415,BENJAMIN N CARDOZO HIGH SCHOOL,427,515,0.45329087,0.5467091326Q430,FRANCIS LEWIS HIGH SCHOOL,574,593,0.491859469,0.50814053126Q435,MARTIN VAN BUREN HIGH SCHOOL,405,364,0.526657997,0.47334200326Q495,BAYSIDE HIGH SCHOOL,440,532,0.452674897,0.54732510326Q566,"QUEENS HIGH SCHOOL OF TEACHING, LIBERAL ARTS AND S",127,160,0.442508711,0.55749128927Q260,FREDERICK DOUGLAS ACADEMY VI HIGH SCHOOL,43,62,0.40952381,0.5904761927Q262,CHANNEL VIEW SCHOOL FOR RESEARCH,48,53,0.475247525,0.52475247527Q302,"QUEENS HIGH SCHOOL FOR INFORMATION, RESEARCH AND T",7,5,0.583333333,0.41666666727Q323,SCHOLARS' ACADEMY,39,61,0.39,0.6127Q400,AUGUST MARTIN HIGH SCHOOL,156,124,0.557142857,0.44285714327Q410,BEACH CHANNEL HIGH SCHOOL,212,162,0.56684492,0.43315508